{
  "schema_version": "1.0",
  "id": "meta-dekalb-illinois",
  "name": "Meta DeKalb Data Center",
  "aliases": [
    "DeKalb Data Center"
  ],
  "summary": "Meta campus at 2050 Metaverse Way on the south side of DeKalb, Illinois, off Interstate 88. Meta broke ground in 2020 on a planned five-building campus of more than 2.3 million sq ft and more than USD 1 billion of investment. It came online in late November 2023, when the Illinois governor attended the opening; local reports said two buildings were serving traffic and about 1 million sq ft had been built. Meta says it planned its energy needs with ComEd and pays the full cost of the energy the campus uses.",
  "location": {
    "country": "US",
    "admin1": "Illinois",
    "admin2": "DeKalb County",
    "locality": "DeKalb",
    "lat": 41.8894,
    "lon": -88.7265,
    "precision": "approximate_site",
    "source_ids": [
      "s1",
      "s3"
    ],
    "note": "Mean of three building outlines tagged as Meta-operated data centers in the local OpenStreetMap layer (ways 1312792611, 1312792612, 1312792613) on DeKalb's south side, consistent with the cited address on Metaverse Way off I-88. The point is a building centroid average, not a surveyed parcel."
  },
  "status": "partially_operational",
  "status_as_of": "2023-12-01",
  "status_source_ids": [
    "s3",
    "s4"
  ],
  "notes": "At the November 2023 opening, the state release called the campus fully operational, while local reports said two of five planned buildings were serving traffic and about 1 million of 2.3 million sq ft had been built; the status follows the building-level reporting. No later report on the remaining buildings was found. Meta's fact sheet (s1) shows no publication date; its embedded file creation date is 2026-09-02.",
  "workloads": [],
  "parties": [
    {
      "name": "Meta Platforms",
      "role": "developer",
      "source_ids": [
        "s1",
        "s3"
      ]
    },
    {
      "name": "Meta Platforms",
      "role": "operator",
      "source_ids": [
        "s2",
        "s3"
      ]
    },
    {
      "name": "ComEd",
      "role": "utility",
      "source_ids": [
        "s1",
        "s2"
      ]
    },
    {
      "name": "City of DeKalb",
      "role": "government",
      "source_ids": [
        "s1",
        "s2"
      ],
      "note": "Partnered with Meta and ComEd on serving the campus; Meta says it pays the full cost of city water and wastewater service."
    }
  ],
  "metrics": [
    {
      "metric": "investment",
      "value": 1000000000,
      "qualifier": "more_than",
      "unit": "USD",
      "basis": "announced",
      "applies_to": "campus",
      "as_of": "2023-11-29",
      "source_ids": [
        "s1",
        "s2",
        "s3"
      ]
    },
    {
      "metric": "floor_area",
      "value": 2300000,
      "qualifier": "more_than",
      "unit": "sq_ft",
      "basis": "planned",
      "applies_to": "campus",
      "as_of": "2023-12-01",
      "source_ids": [
        "s2",
        "s3",
        "s4"
      ]
    },
    {
      "metric": "floor_area",
      "value": 1000000,
      "qualifier": "approximately",
      "unit": "sq_ft",
      "basis": "operational",
      "applies_to": "phase",
      "phase_label": "Built by November 2023",
      "as_of": "2023-11-29",
      "source_ids": [
        "s4"
      ],
      "note": "Space reported as built at the November 2023 opening, when two of the five planned buildings were serving traffic."
    },
    {
      "metric": "buildings",
      "value": 5,
      "qualifier": "exact",
      "unit": "count",
      "basis": "planned",
      "applies_to": "campus",
      "as_of": "2023-12-01",
      "source_ids": [
        "s3"
      ]
    },
    {
      "metric": "buildings",
      "value": 2,
      "qualifier": "exact",
      "unit": "count",
      "basis": "operational",
      "applies_to": "phase",
      "phase_label": "First two buildings",
      "as_of": "2023-12-01",
      "source_ids": [
        "s3"
      ]
    },
    {
      "metric": "jobs_construction",
      "value": 1200,
      "qualifier": "more_than",
      "unit": "count",
      "basis": "reported",
      "applies_to": "campus",
      "as_of": "2023-11-29",
      "source_ids": [
        "s1",
        "s2"
      ],
      "note": "Skilled trade workers during construction; Meta's fact sheet gives 1,200 at peak."
    },
    {
      "metric": "jobs_permanent",
      "value": 200,
      "qualifier": "more_than",
      "unit": "count",
      "basis": "planned",
      "applies_to": "campus",
      "as_of": "2023-11-29",
      "source_ids": [
        "s1",
        "s2",
        "s3"
      ],
      "note": "Once fully operational; about 80 people were employed at the opening."
    }
  ],
  "milestones": [
    {
      "event": "construction_started",
      "date": "2020",
      "kind": "actual",
      "source_ids": [
        "s1",
        "s3"
      ]
    },
    {
      "event": "first_operational",
      "date": "2023-11-29",
      "kind": "actual",
      "source_ids": [
        "s2",
        "s3",
        "s4"
      ],
      "note": "Opening ceremony; the first two buildings began carrying live traffic that week."
    }
  ],
  "power_sources": [
    {
      "type": "grid",
      "description": "Served by ComEd, which partnered with Meta and the City of DeKalb to power the campus; Meta says it planned its energy needs with the utility and pays the full cost of the energy used, and the state release says the data center is supported by 100% renewable energy.",
      "source_ids": [
        "s1",
        "s2"
      ]
    }
  ],
  "sources": [
    {
      "id": "s1",
      "url": "https://datacenters.atmeta.com/wp-content/uploads/2026/09/Meta_s-DeKalb-Data-Center.pdf",
      "title": "Meta DeKalb Data Center fact sheet",
      "publisher": "Meta Platforms",
      "published": null,
      "accessed": "2026-10-09",
      "type": "company"
    },
    {
      "id": "s2",
      "url": "https://gov.illinois.gov/news/press-release.28370.html",
      "title": "Gov. Pritzker Celebrates Opening of Meta's DeKalb Data Center",
      "publisher": "Office of the Governor of Illinois",
      "published": "2023-11-29",
      "accessed": "2026-10-09",
      "type": "government"
    },
    {
      "id": "s3",
      "url": "https://www.shawlocal.com/daily-chronicle/2023/11/30/meta-takes-dekalb-data-center-online",
      "title": "Meta takes DeKalb Data Center online",
      "publisher": "Daily Chronicle (Shaw Local)",
      "published": "2023-12-01",
      "accessed": "2026-10-09",
      "type": "news",
      "archived_url": "https://web.archive.org/web/20260828024302/https://www.shawlocal.com/daily-chronicle/2023/11/30/meta-takes-dekalb-data-center-online/"
    },
    {
      "id": "s4",
      "url": "https://www.fox32chicago.com/news/meta-new-illinois-data-center-operational",
      "title": "Meta's new Illinois data center now operational",
      "publisher": "FOX 32 Chicago",
      "published": "2023-11-29",
      "accessed": "2026-10-09",
      "type": "news"
    }
  ],
  "last_reviewed": "2026-10-09"
}
